{
  "schema_version": "1.0",
  "record_id": "cat-send-email",
  "name": "Send Email Activity",
  "component_type": "activity",
  "version": "1.0.0",
  "description": "Sends transactional email to customer",
  "schema_definition": {
    "type": "object",
    "properties": {
      "template_id": { "type": "string" }
    }
  },
  "content_hash": "c3d4e5f67890123456789abcdef0123456789abcdef0123456789abcdef012",
  "tags": [
    "email",
    "notification",
    "messaging"
  ],
  "is_deprecated": false
}
